<?xml version="1.0" encoding="UTF-8"?>
<p:电子文件封装包 xmlns:p="http://www.saac.gov.cn/standards/ERM/encapsulation" xmlns:xsi="http://www.w3.org/2001/XMLSchema-instance" xsi:schemaLocation="http://www.saac.gov.cn/standards/ERM/encapsulation a.xsd ">
  <p:封装包格式描述>本EEP根据中华人民共和国档案行业标准DA/T 48-2009《基于XML的电子文件封装规范》生成</p:封装包格式描述>
  <p:版本>2009</p:版本>
  <p:被签名对象 eep版本="2009">
    <p:封装包类型>原始型</p:封装包类型>
    <p:封装包类型描述>本封装包包含电子文件数据及其元数据，原始封装，未经修改</p:封装包类型描述>
    <p:封装包创建时间>2001-12-31T12:00:00</p:封装包创建时间>
    <p:封装包创建单位>p:封装包创建单位</p:封装包创建单位>
    <p:封装内容>
      <p:文件实体块>
        <p:文件实体>
          <p:聚合层次>文件</p:聚合层次>
          <p:来源>
            <p:档案馆名称>p:档案馆名称</p:档案馆名称>
            <p:档案馆代码>p:档案馆代码</p:档案馆代码>
            <p:全宗名称>p:全宗名称</p:全宗名称>
            <p:立档单位名称>p:立档单位名称</p:立档单位名称>
          </p:来源>
          <p:电子文件号>p:电子文件号</p:电子文件号>
          <p:档号>
            <p:全宗号>p:全宗号</p:全宗号>
            <p:目录号>p:目录号</p:目录号>
            <p:年度>2001</p:年度>
            <p:保管期限>p:保管期限</p:保管期限>
            <p:机构或问题>p:机构或问题</p:机构或问题>
            <p:类别号>p:类别号</p:类别号>
            <p:室编案卷号>p:室编案卷号</p:室编案卷号>
            <p:馆编案卷号>p:馆编案卷号</p:馆编案卷号>
            <p:馆编件号>1</p:馆编件号>
            <p:页号>p:页号</p:页号>
          </p:档号>
          <p:内容描述>
            <p:题名>p:题名</p:题名>
            <p:并列题名>p:并列题名</p:并列题名>
            <p:副题名>p:副题名</p:副题名>
            <p:说明题名文字>p:说明题名文字</p:说明题名文字>
            <p:主题词 主题词表名称="">p:主题词</p:主题词>
            <p:关键词>p:关键词</p:关键词>
            <p:人名>p:人名</p:人名>
            <p:摘要>p:摘要</p:摘要>
            <p:分类号>p:分类号</p:分类号>
            <p:文件编号>p:文件编号</p:文件编号>
            <p:责任者>p:责任者</p:责任者>
            <p:日期>p:日期</p:日期>
            <p:文种>p:文种</p:文种>
            <p:紧急程度>p:紧急程度</p:紧急程度>
            <p:主送>p:主送</p:主送>
            <p:抄送>p:抄送</p:抄送>
            <p:密级>p:密级</p:密级>
            <p:保密期限>p:保密期限</p:保密期限>
          </p:内容描述>
          <p:形式特征>
            <p:文件组合类型>单件</p:文件组合类型>
            <p:页数>1</p:页数>
            <p:语种>汉语</p:语种>
            <p:稿本>p:稿本</p:稿本>
          </p:形式特征>
          <p:存储位置>
            <p:当前位置>p:当前位置</p:当前位置>
            <p:脱机载体编号>p:脱机载体编号</p:脱机载体编号>
            <p:脱机载体存址>p:脱机载体存址</p:脱机载体存址>
            <p:缩微号>p:缩微号</p:缩微号>
          </p:存储位置>
          <p:权限管理>
            <p:知识产权说明>p:知识产权说明</p:知识产权说明>
            <p:授权>
              <p:授权对象>p:授权对象</p:授权对象>
              <p:授权行为>p:授权行为</p:授权行为>
            </p:授权>
            <p:控制标识>p:控制标识</p:控制标识>
          </p:权限管理>
          <p:信息系统描述>p:信息系统描述</p:信息系统描述>
          <p:附注>p:附注</p:附注>
          <p:文件数据>
            <p:文档>
              <p:文档标识符>idvalue0</p:文档标识符>
              <p:文档序号>p:文档序号</p:文档序号>
              <p:文档主从声明>主文档</p:文档主从声明>
              <p:题名>p:题名</p:题名>
              <p:文档数据 文档数据ID="idvalue1">
                <p:编码 编码ID="idvalue2">
                  <p:电子属性>
                    <p:格式信息>p:格式信息</p:格式信息>
                    <p:计算机文件名>p:计算机文件名</p:计算机文件名>
                    <p:计算机文件大小>p:计算机文件大小</p:计算机文件大小>
                    <p:文档创建程序>p:文档创建程序</p:文档创建程序>
                  </p:电子属性>
                  <p:数字化属性>
                    <p:数字化对象形态>p:数字化对象形态</p:数字化对象形态>
                    <p:扫描分辨率>p:扫描分辨率</p:扫描分辨率>
                    <p:扫描色彩模式>黑白二值</p:扫描色彩模式>
                    <p:图像压缩方案>p:图像压缩方案</p:图像压缩方案>
                  </p:数字化属性>
                  <p:编码描述>本封装包中“编码数据”元素存储的是计算机文件二进制流的Base64编码，有关Base64编码规则参见IETF RFC 2045多用途邮件扩展（MIME）第一部分：互联网信息体格式。当提取和显现封装在编码数据元素中的计算机文件时，应对Base64编码进行反编码，并依据封装包中“反编码关键字”元素中记录的值还原计算机文件的扩展名</p:编码描述>
                  <p:反编码关键字>p:反编码关键字</p:反编码关键字>
                  <p:编码数据 引用编码数据ID="idvalue0" 编码数据ID="idvalue3">MA==</p:编码数据>
                </p:编码>
              </p:文档数据>
            </p:文档>
          </p:文件数据>
        </p:文件实体>
        <p:文件实体关系>
          <p:文件标识符>p:文件标识符</p:文件标识符>
          <p:被关联文件标识符>p:被关联文件标识符</p:被关联文件标识符>
          <p:关系类型>p:关系类型</p:关系类型>
          <p:关系>p:关系</p:关系>
          <p:关系描述>p:关系描述</p:关系描述>
        </p:文件实体关系>
      </p:文件实体块>
      <p:业务实体块>
        <p:业务实体>
          <p:业务标识符>p:业务标识符</p:业务标识符>
          <p:机构人员标识符>p:机构人员标识符</p:机构人员标识符>
          <p:文件标识符>p:文件标识符</p:文件标识符>
          <p:业务状态>历史行为</p:业务状态>
          <p:业务行为>p:业务行为</p:业务行为>
          <p:行为时间>p:行为时间</p:行为时间>
          <p:行为依据>p:行为依据</p:行为依据>
          <p:行为描述>p:行为描述</p:行为描述>
        </p:业务实体>
      </p:业务实体块>
      <p:机构人员实体块>
        <p:机构人员实体>
          <p:机构人员标识符>p:机构人员标识符</p:机构人员标识符>
          <p:机构人员类型>单位</p:机构人员类型>
          <p:机构人员名称>p:机构人员名称</p:机构人员名称>
          <p:组织机构代码>p:组织机构代码</p:组织机构代码>
          <p:个人职位>p:个人职位</p:个人职位>
        </p:机构人员实体>
        <p:机构人员实体关系>
          <p:机构人员标识符>p:机构人员标识符</p:机构人员标识符>
          <p:被关联机构人员标识符>p:被关联机构人员标识符</p:被关联机构人员标识符>
          <p:关系类型>p:关系类型</p:关系类型>
          <p:关系>p:关系</p:关系>
          <p:关系描述>p:关系描述</p:关系描述>
        </p:机构人员实体关系>
      </p:机构人员实体块>
    </p:封装内容>
  </p:被签名对象>
  <p:电子签名块>
    <p:电子签名>
      <p:签名标识符>idvalue4</p:签名标识符>
      <p:签名规则>p:签名规则</p:签名规则>
      <p:签名时间>2001-12-31T12:00:00</p:签名时间>
      <p:签名人>p:签名人</p:签名人>
      <p:签名结果>MA==</p:签名结果>
      <p:证书块>
        <p:证书>MA==</p:证书>
        <p:证书引证>http://tempuri.org</p:证书引证>
      </p:证书块>
      <p:签名算法标识>p:签名算法标识</p:签名算法标识>
    </p:电子签名>
  </p:电子签名块>
  <p:锁定签名>
    <p:被锁定签名标识符>idvalue0</p:被锁定签名标识符>
    <p:签名规则>p:签名规则</p:签名规则>
    <p:签名时间>2001-12-31T12:00:00</p:签名时间>
    <p:签名人>p:签名人</p:签名人>
    <p:签名结果>MA==</p:签名结果>
    <p:证书块>
      <p:证书>MA==</p:证书>
      <p:证书引证>http://tempuri.org</p:证书引证>
    </p:证书块>
    <p:签名算法标识>p:签名算法标识</p:签名算法标识>
  </p:锁定签名>
</p:电子文件封装包>
